{
    "version": "server_result_v1",
    "turnNo": 88,
    "node": {
        "id": "node_6",
        "type": "REST",
        "index": 6,
        "state": "NODE_ENDED"
    },
    "summary": {
        "short": "짧은 휴식으로 체력과 집중을 회복했다."
    },
    "events": [
        {
            "id": "e1",
            "kind": "SYSTEM",
            "text": "짧은 휴식을 취했다.",
            "tags": [
                "REST"
            ],
            "data": {}
        },
        {
            "id": "e2",
            "kind": "STATUS",
            "text": "피로가 가라앉았다.",
            "tags": [
                "RECOVER"
            ],
            "data": {
                "statusId": "FATIGUE",
                "op": "REMOVED"
            }
        }
    ],
    "diff": {
        "player": {
            "hp": {
                "from": 64,
                "to": 92,
                "delta": 28
            },
            "stamina": {
                "from": 1,
                "to": 4,
                "delta": 3
            },
            "status": [
                {
                    "statusId": "FATIGUE",
                    "op": "REMOVED",
                    "stacks": 0,
                    "duration": 0
                }
            ]
        },
        "enemies": [],
        "inventory": {
            "itemsAdded": [],
            "itemsRemoved": [],
            "goldDelta": 0
        },
        "meta": {
            "battle": {
                "phase": "NONE",
                "rngConsumed": 0
            },
            "position": {
                "distance": "OUT",
                "angle": "FRONT",
                "env": [
                    "COVER"
                ]
            }
        }
    },
    "ui": {
        "availableActions": [
            "MOVE",
            "INVENTORY",
            "NOTE"
        ],
        "targetLabels": [],
        "actionSlots": {
            "base": 2,
            "bonusAvailable": false,
            "max": 3
        },
        "toneHint": "calm"
    },
    "choices": [],
    "flags": {
        "bonusSlot": false,
        "downed": false,
        "battleEnded": false,
        "nodeTransition": true
    }
}